Event_Id,Event_Name,Event_Summary,Event_Organizer,start_date,url,is_online_event
294614298297,Black-Owned Hackney Night Market,Friday night market featuring exclusively Black-owned businesses,20229697518,2022-08-12,https://www.eventbrite.co.uk/e/black-owned-hackney-night-market-tickets-294614298297,false
294734888987,Plant Based Social,Vegan street market in the heart of Hackney,20229697518,2022-07-23,https://www.eventbrite.co.uk/e/plant-based-social-tickets-294734888987,false
219197253887,Vivaldi - The Four Seasons by Candlelight,Vivaldi - The Four Seasons by Candlelight,16457805814,2022-07-30,https://www.eventbrite.co.uk/e/vivaldi-the-four-seasons-by-candlelight-tickets-219197253887,false
294599865127,Black-Owned Hackney Market - Weekender,Weekend market featuring exclusively Black-owned businesses,20229697518,2022-07-30,https://www.eventbrite.co.uk/e/black-owned-hackney-market-weekender-tickets-294599865127,false
294747205827,Vegan East LDN,More than just a vegan market!,20229697518,2022-07-29,https://www.eventbrite.co.uk/e/vegan-east-ldn-tickets-294747205827,false
269150515437,The Poetry Lounge,Come on in and gather round  we'd like to welcome you to The Poetry Lounge!,41350641393,2022-08-03,https://www.eventbrite.com/e/the-poetry-lounge-tickets-269150515437,false
265263067977,HYPER JAPAN Festival 2022 Ticket,HYPER JAPAN is back from the 22nd to the 24th of July 2022! Grab your ticket and join us to celebrate everything Japanese!,26259111025,2022-07-22,https://www.eventbrite.co.uk/e/hyper-japan-festival-2022-ticket-tickets-265263067977,false
9120629047,MR MUSIC MAN KOJO ANTWI LIVE IN LONDON,KOJO ANTWI LIVE IN LONDON FOR ONE NIGHT ONLY  THIS SUMMER 30th JULY 2022 WITH KECHE & DAVISON BAND  INFO 07525248643 £35 TICKETS,5235788751,2022-07-30,https://www.eventbrite.co.uk/e/mr-music-man-kojo-antwi-live-in-london-tickets-9120629047,false
340356544587,FUNK IN RIO FESTIVAL +BORGES & L7NNON,FUNK IN RIO FESTIVAL,38244157163,2022-07-24,https://www.eventbrite.com/e/funk-in-rio-festival-borges-l7nnon-tickets-340356544587,false
309411126007,BLESSD "BENDECIDO" LIVE IN CONCERT IN LONDON - FRIDAY 29TH JULY 2022,BLESSD is Colombia’s next big Reggaeton Super Star! Catch him performing Live in London at the Electric Brixton on Friday 29th July  2022!,17966121631,2022-07-29,https://www.eventbrite.co.uk/e/blessd-bendecido-live-in-concert-in-london-friday-29th-july-2022-tickets-309411126007,false
319467635297,A Tribute to Hans Zimmer & John Williams by Moonlight: London  Early Show,An immersive tribute to Hans Zimmer and John William's most iconic music with a live chamber orchestra in a moon-lit setting.,45256331173,2022-08-05,https://www.eventbrite.co.uk/e/a-tribute-to-hans-zimmer-john-williams-by-moonlight-london-early-show-tickets-319467635297,false
293073449577,NEON NAKED LIFE DRAWING | PRINCE OF PECKHAM | PECKHAM,DRAW IN NEON  IMMERSED IN ULTRA-VIOLET LIGHT  AT THE PRINCE OF PECKHAM!,12148068361,2022-08-09,https://www.eventbrite.co.uk/e/neon-naked-life-drawing-prince-of-peckham-peckham-tickets-293073449577,false
218227021897,Networking Event London  Meet Entrepreneurs  Business Owners  Investors  UK,Networking Event London  Meet Entrepreneurs  Business Owners  Investors at this Evening Networking Event/Party. Free Drinks & Snacks.,16755069193,2022-07-21,https://www.eventbrite.co.uk/e/networking-event-london-meet-entrepreneurs-business-owners-investors-uk-tickets-218227021897,false
344121836677,Carib Nation & Friends: Welcome to Carnival 2022,Join us with a few of our GOOD friends as we get you ready for Notting Hill Carnival 2022!,19826111051,2022-08-24,https://www.eventbrite.co.uk/e/carib-nation-friends-welcome-to-carnival-2022-tickets-344121836677,false
381967534177,In-Person Memory Masterclass On How to Unlock Your Brain’s Potential,Summary,23398917848,2022-07-23,https://www.eventbrite.co.uk/e/in-person-memory-masterclass-on-how-to-unlock-your-brains-potential-tickets-381967534177,false
237558884017,The MildMay Jazz Club,The Mildmay jazz club,8492414667,2022-07-26,https://www.eventbrite.co.uk/e/the-mildmay-jazz-club-tickets-237558884017,false
381069698727,Free Street Art Walking Tour,Enter a world of possibility where the walls are blank canvases and the flick of a spray can inspire rebellion and revolution.,33163975087,2022-07-22,https://www.eventbrite.co.uk/e/free-street-art-walking-tour-tickets-381069698727,false
298320333147,LatinoLife In The Park 2022,The UK’s largest Latin music festival  is back for its 6th year - 2 days  a unique celebration - register for further details,27216359183,2022-08-20,https://www.eventbrite.co.uk/e/latinolife-in-the-park-2022-tickets-298320333147,false
340391188207,Ecstatic Dance UK - SUN•DAY IN•SIDE,AT THE BATHS - Amazing space  HI quality sound  great hangout with SAUNA's/plunge & food available after!!    Movement / Music / Mindfulness,17916431216,2022-07-24,https://www.eventbrite.co.uk/e/ecstatic-dance-uk-sunday-inside-tickets-340391188207,false
356542376847,Soca Starter UK,Soca Starter UK returns to Notthinghill weekend.,17590783528,2022-08-26,https://www.eventbrite.com/e/soca-starter-uk-tickets-356542376847,false
377196634287,Get into 01Founders  - a coding taster session with a difference,Experience collaborative learning through coding in a 01Founders taster session,33516745313,2022-07-28,https://www.eventbrite.co.uk/e/get-into-01founders-a-coding-taster-session-with-a-difference-tickets-377196634287,false
308717982797,BIG FAT QUIZBOX,QUIZBOX RETURNS,11096442149,2022-07-25,https://www.eventbrite.co.uk/e/big-fat-quizbox-tickets-308717982797,false
334532113557,Maiden Voyage  by JeeYoung Lee - Weekend Bookings,NOW Gallery are delighted to present 'Maiden Voyage' by JeeYoung Lee  as the 2022 Fine Art Commission.,27713627867,2022-07-23,https://www.eventbrite.co.uk/e/maiden-voyage-by-jeeyoung-lee-weekend-bookings-tickets-334532113557,false
165218303393,BOOM at Loop,BOOM vs CARWASH.  A Sophisticated Playground of 3 Floors of Pure Partying in Central London. Every Saturday At Loop  19 Dering St. W1S 1AH.,1531945072,2022-07-23,https://www.eventbrite.co.uk/e/boom-at-loop-tickets-165218303393,false
96354684455,20 Year of Breakin Science Festival,Celebrating 20 Years of Breakin Science... in a field with 3 arenas of music!,29485800845,2022-08-20,https://www.eventbrite.co.uk/e/20-year-of-breakin-science-festival-tickets-96354684455,false
356193172367,Kintsugi Workshop,Mend your once loved China with a golden repair WHAT'S THIS ALL ABOUT? Kintsugi  the Japanese art of embracing your imperfections. Learn how to mend once loved china and earthenware in this mindful introduction to the Kintsugi method. The visible repairs are seen as part of the history of an object  highlighting the cracks and symbolising fragility  strength and beauty. This golden repair is called Kintsugi. WHAT HAPPENS IN THIS WORKSHOP? The idea of this workshop is to repair a loved item  join,16076876847,2022-10-06,https://www.eventbrite.co.uk/e/kintsugi-workshop-tickets-356193172367,false
277745583517,Adults evening art class with CREATE,Adults monthly evening art class  every second Wednesday of the month. **July is all about Pointillism**,33768291899,2022-08-10,https://www.eventbrite.co.uk/e/adults-evening-art-class-with-create-tickets-277745583517,false
230281105987,Dropshipping eCommerce Training Course  Online Business Web Design  Selling,FREE DROPSHIPPING COURSE: WE HELP YOU TO START YOUR UK DROPSHIPPING BUSINESS with GUARANTEED SUCCESS!,16755069193,2022-07-24,https://www.eventbrite.co.uk/e/dropshipping-ecommerce-training-course-online-business-web-design-selling-tickets-230281105987,false
334888519577,LOCURA FRIDAYS,LONDON GET READY! UK'S CRAZIEST LATIN PARTY IS BACK AT PARADISE SUPER CLUB LONDON EVERY FRIDAY,19943454747,2022-07-22,https://www.eventbrite.co.uk/e/locura-fridays-tickets-334888519577,false
271611807227,Kiki Drag Cabaret: Early Show (Doors 6pm) Show 7-8.30pm,Every Saturday night it’s time to dim the lights  pop the bottles  get the girls in and get ready to be gagged by our crazy cabaret.,29708198809,2022-07-23,https://www.eventbrite.co.uk/e/kiki-drag-cabaret-early-show-doors-6pm-show-7-830pm-tickets-271611807227,false
259338487397,FTP All Black Boat Party,A luxurious boat party experience on the River Thames,41970510313,2022-07-30,https://www.eventbrite.co.uk/e/ftp-all-black-boat-party-tickets-259338487397,false
331454107157,Fighting Fantasy Fest 4 & You Are The Beer-o present: The Fourester of Doom,Get warmed up for FIGHTING FANTASY FEST 4 with a special You Are The Beer-o get together for Fighting Fantasy fans!,6487095007,2022-09-02,https://www.eventbrite.co.uk/e/fighting-fantasy-fest-4-you-are-the-beer-o-present-the-fourester-of-doom-tickets-331454107157,false
255288553937,Stampex 2022,A fun philatelic and collectibles experience for all – from a new collector to an advanced philatelist or anyone looking for a fun day out,33920185765,2022-09-28,https://www.eventbrite.co.uk/e/stampex-2022-tickets-255288553937,false
158316497907,Learn to Trade Forex & Bitcoin in London - FOREX Trading LONDON ,Learn how to trade FOREX & cryptocurrencies like Bitcoin in London.  We will show you how to  build a 6 and 7 figure trading account.,29892050827,2022-07-24,https://www.eventbrite.co.uk/e/learn-to-trade-forex-bitcoin-in-london-forex-trading-london-tickets-158316497907,false
274250138547,Growing Underground urban farm tour,Feeling curious? Growing Underground operates 33 meters underneath the streets of Clapham  London in a former WWII air raid shelter.,17939252857,2022-08-04,https://www.eventbrite.co.uk/e/growing-underground-urban-farm-tour-tickets-274250138547,false
264316757537,Creative Photography,This active day explores urban and cityscape photography  photographic techniques  opportunities to take your own images to review later.,1905500785,2022-07-30,https://www.eventbrite.co.uk/e/creative-photography-registration-264316757537,false
359515780377,RESTORATION LONDON Sashiko+Boro - Japanese Mending Workshop,Learn the traditional Japanese mending embroidery method of Sashiko and Boro stitching- to fix and revive your damaged or old clothing!,29540843465,2022-07-23,https://www.eventbrite.co.uk/e/restoration-london-sashikoboro-japanese-mending-workshop-tickets-359515780377,false
274947704987,UB40 in Windsor,Get ready for UB40 LIVE at Windsor Racecourse!,19928264152,2022-08-12,https://www.eventbrite.co.uk/e/ub40-in-windsor-tickets-274947704987,false
327107546477,The London Watch Show,The London Watch Show - The Capitals Largest Watch Event,33395496471,2022-09-17,https://www.eventbrite.co.uk/e/the-london-watch-show-tickets-327107546477,false
366735524827,The London Four Pounds Drawing Class - The London £4 Drawing Class,This class was created to inspire any one to dare to dive and enjoy drawing.  Explore  learn  grow.,30916596795,2022-07-22,https://www.eventbrite.co.uk/e/the-london-four-pounds-drawing-class-the-london-4-drawing-class-tickets-366735524827,false
302577406167,#mtpcon London+EMEA 2022,Kick off a full year of product learning at the world’s best hybrid product conference,1962515111,2022-10-13,https://www.eventbrite.com/e/mtpcon-londonemea-2022-tickets-302577406167,false
386806928937,** Kayak Bus (Greenwich to Battersea).,Kayak sightseeing trip  Greenwich to Battersea.  Passing through Central London from East to West. Seeing Londons most famous landmarks.,8551940451,2022-07-26,https://www.eventbrite.co.uk/e/kayak-bus-greenwich-to-battersea-tickets-386806928937,false
323781668687,Escape Bar Pub Quiz - Stratford,ESCAPE STRATFORD'S WEEKYL QUIZ NIGHT,31394247105,2022-07-25,https://www.eventbrite.co.uk/e/escape-bar-pub-quiz-stratford-tickets-323781668687,false
333642984147,Free  family-friendly outdoor fun in Gillespie Park,We'll be either pond dipping or meadow sweeping plus some nature crafts in Gillespie Park. All free and family-friendly. Suitable for ages,17944623188,2022-08-10,https://www.eventbrite.co.uk/e/free-family-friendly-outdoor-fun-in-gillespie-park-tickets-333642984147,false
386006003347,SOUND HEALING GONGMEDITATIONS,SOUND HEALING GONG MEDITATIONS,17370936295,2022-07-30,https://www.eventbrite.co.uk/e/sound-healing-gongmeditations-tickets-386006003347,false
293757455457,Royal Wharf Summer Fete,The perfect family day out in the sun! Join us at the Royal Wharf Summer Fete on Saturday 17th September  between 11am – 6pm.,34125793011,2022-09-17,https://www.eventbrite.co.uk/e/royal-wharf-summer-fete-tickets-293757455457,false
114825468066,LUXURY WINE  CHAMPAGNE & PORT TASTING PAIRED WITH CHEESE & TRUFFLES,Luxury Wine Tasting: a fun and informative evening of fine wine  Champagne   vintage Port  cheese  chocolate and truffles with Kam Zadeh,30164930708,2022-07-23,https://www.eventbrite.co.uk/e/luxury-wine-champagne-port-tasting-paired-with-cheese-truffles-tickets-114825468066,false
299625316387,Fundamentals of Flow Cytometry - In person,This one day course will provide an introduction to flow cytometry in a classroom setting. Led by Derek Davies.,2518011556,2022-07-26,https://www.eventbrite.co.uk/e/fundamentals-of-flow-cytometry-in-person-tickets-299625316387,false
350500806347,The Silent Q In LGBTQ,An exploration and unpacking of the concept of “questioning”  followed by some exercises to help you feel more comfortable being unsure,37663218863,2022-07-24,https://www.eventbrite.co.uk/e/the-silent-q-in-lgbtq-tickets-350500806347,false
353635442127,LONDON IN-PERSON | IDSA 19th Anniversary Summer Showcase,IDSA 19th Anniversary Summer Showcase - London In-person,12407938809,2022-07-21,https://www.eventbrite.co.uk/e/london-in-person-idsa-19th-anniversary-summer-showcase-tickets-353635442127,false
318769246397,Soul Supper Immersive Dining Experience 2022 - LONDON,The award-winning soul supper returns to London with multiple 2021 shows!,32760532621,2022-08-05,https://www.eventbrite.co.uk/e/soul-supper-immersive-dining-experience-2022-london-tickets-318769246397,false
167993425859,Kenya and Friends in the Park 2022,This is an annual event held in London for Kenyans and their friends to meet  mingle  showcase business and talent,18192907094,2022-09-17,https://www.eventbrite.co.uk/e/kenya-and-friends-in-the-park-2022-tickets-167993425859,false
324686164057,Holiday workshops: Spectacular  colour chemistry (ages 16–18),Discover what a colour actually is  understand how objects become coloured  and how Chemists can manipulate these aspects to produce dyes.,4269650797,2022-08-04,https://www.eventbrite.co.uk/e/holiday-workshops-spectacular-colour-chemistry-ages-1618-tickets-324686164057,false
323744798407,Gingers Big Drag Bottomless Brunch: 3-5pm,Are you craving an afternoon of glittering  Prosecco-fuelled  drag fabulousness. Well  look no further than Ginger’s Big Drag Brunch!,29708198809,2022-07-23,https://www.eventbrite.co.uk/e/gingers-big-drag-bottomless-brunch-3-5pm-tickets-323744798407,false
292390797747,Top of the Block Quiz,Roof East have teamed up with the best hosts in town to bring you a weekly dose of trivia  silliness and prizes.,26375725653,2022-08-02,https://www.eventbrite.co.uk/e/top-of-the-block-quiz-tickets-292390797747,false
368834252177,Raynes Park Library Storytime - Tuesday,Raynes Park Library - Storytime!,26471263771,2022-07-26,https://www.eventbrite.co.uk/e/raynes-park-library-storytime-tuesday-tickets-368834252177,false
336493640537,ConnectAsian Singles Event - Bad Axe Throwing,ConnectAsian - Singles Event - Axe Throwing. Ready to Impress? Come hang out with the coolest singles and have a go at AXE THROWING!,5288402487,2022-07-30,https://www.eventbrite.co.uk/e/connectasian-singles-event-bad-axe-throwing-tickets-336493640537,false
190214896877,OPEN REFLECTIVE DAYS -2022,Open Reflective Day  - a chance to come to this extraordinary  urban oasis  for your personal quiet day.,4059729563,2022-08-08,https://www.eventbrite.co.uk/e/open-reflective-days-2022-tickets-190214896877,false
295335545567,The Data School - Meet & Greet August 2022,In-Person event with details about life at The Data School  software demos  networking opportunities and application information.,7880971316,2022-08-02,https://www.eventbrite.co.uk/e/the-data-school-meet-greet-august-2022-tickets-295335545567,false
208564661517,Drag Queen Disco Diva Tour- Silent Disco Walking Tour #silenttours,Dance and sing your way through the iconic streets of Soho with our fabulous Drag Queen Host.,7649221343,2022-07-29,https://www.eventbrite.co.uk/e/drag-queen-disco-diva-tour-silent-disco-walking-tour-silenttours-tickets-208564661517,false
342761608197,Get Wild!,Get Wild! hosts an assortment of  slides  tunnels  rope walks  climbing frames and much  much more!,31431681323,2022-07-21,https://www.eventbrite.co.uk/e/get-wild-tickets-342761608197,false
332651869697,Wanstead Festival 2022,Annual Festival for all the Family. Stalls  Music  Refreshments and fun activities.,8294877519,2022-09-18,https://www.eventbrite.co.uk/e/wanstead-festival-2022-tickets-332651869697,false
324733274967,Holiday Workshops: Spectacular colour chemistry (age 7–9),Discover what a colour actually is  understand how objects become coloured  and how Chemists can manipulate these aspects to produce dyes.,4269650797,2022-08-08,https://www.eventbrite.co.uk/e/holiday-workshops-spectacular-colour-chemistry-age-79-tickets-324733274967,false
323066319057,Adventure Academy Summer 2022 - Week 2,A week full of outdoor adventurous fun at Lambourne End! Book now to challenge yourself and develop new skills this Summer.,33174770127,2022-08-01,https://www.eventbrite.co.uk/e/adventure-academy-summer-2022-week-2-tickets-323066319057,false
306024937827,GeekstraVEGANza,GeekstraVEGANza @ MAAD,40391564523,2022-08-06,https://www.eventbrite.co.uk/e/geekstraveganza-tickets-306024937827,false
235821858527,Rides for All,A short  local easypaced ride suitable for all,30756116240,2022-07-24,https://www.eventbrite.co.uk/e/rides-for-all-tickets-235821858527,false
293216617797,Menopause  Support - Redbridge Essex,Menopause  Support Group in Redbridge Essex.  Come and Meet Women who want to chat about menopause and related women's health.,32350256653,2022-08-14,https://www.eventbrite.co.uk/e/menopause-support-redbridge-essex-tickets-293216617797,false
240520241517,The Potion Room - Sunday 24th July 2022,An immersive experience  where delicious food and magical potions combine in our wonderful and exclusive world of fantasy.,17899080606,2022-07-24,https://www.eventbrite.co.uk/e/the-potion-room-sunday-24th-july-2022-tickets-240520241517,false
347944359947,Drag Queen Quiz,The ultimate Drag Queen Quiz is back back BACK AGAIN! Hosted and brought to you by the one and only Proud Mary,29245268825,2022-08-03,https://www.eventbrite.co.uk/e/drag-queen-quiz-tickets-347944359947,false
221477413907,BNi Kaleidoscope,Join us for an energising networking meeting with 15+ local business owners.,38678375563,2022-07-21,https://www.eventbrite.co.uk/e/bni-kaleidoscope-tickets-221477413907,false
300000909797,SO YOU WANNA BE AN ACTOR... (5 WEEK WORK SHOP),Join Award winning writer  director and film producer and a team of hand picked professionals  for an exciting  five week acting   workshop.,24120776735,2022-07-24,https://www.eventbrite.co.uk/e/so-you-wanna-be-an-actor-5-week-work-shop-tickets-300000909797,false
321958244777,Single Christians Speed Dating (Ages 30-45),Speed dating events allow you to meet 15-20 singles in your age range for 5 minute mini dates.,31623581285,2022-07-26,https://www.eventbrite.co.uk/e/single-christians-speed-dating-ages-30-45-tickets-321958244777,false
253942166857,London Meditation Group,Meditation Evening (suitable for beginners and advanced practitioners),40416648893,2022-07-21,https://www.eventbrite.co.uk/e/london-meditation-group-tickets-253942166857,false
379600083067,Library training: online or in person,Library training for members of the Royal College of Nursing,7823973102,2022-07-21,https://www.eventbrite.co.uk/e/library-training-online-or-in-person-tickets-379600083067,false
314433728747,Party n Paint @ Roof East,Painting  Good Music and Alcohol - how could you go wrong.,17567001209,2022-08-21,https://www.eventbrite.co.uk/e/party-n-paint-roof-east-tickets-314433728747,false
356961630847,FODASE EU QUERO E FUNK + MC CABELINHO,MC CABELINHO EM LONDRES!,38244157163,2022-10-07,https://www.eventbrite.com/e/fodase-eu-quero-e-funk-mc-cabelinho-tickets-356961630847,false
236950343857,Pranayama • Free Weekly Class • London,Learn the Joy of Breathing technique  practice a deep Pranayama session and enjoy the benefits.,30784000070,2022-07-27,https://www.eventbrite.com/e/pranayama-free-weekly-class-london-tickets-236950343857,false
355149681257,Jazz Jam Hosted by Titus Maz,Our bi-weekly Jazz Jam in Canary Wharf will be hosted by Titus Maz!,33409225909,2022-08-03,https://www.eventbrite.co.uk/e/jazz-jam-hosted-by-titus-maz-tickets-355149681257,false
384404292587,Ethos Climbing Wall Induction Sessions,Ethos Climbing Wall Induction Sessions,42817508083,2022-07-22,https://www.eventbrite.co.uk/e/ethos-climbing-wall-induction-sessions-tickets-384404292587,false
323976280777,Holiday workshops: An introduction to space science (ages 16–18),Dive into the theory of rockets and space travel  and design a mission to Mars.,4269650797,2022-08-08,https://www.eventbrite.co.uk/e/holiday-workshops-an-introduction-to-space-science-ages-1618-tickets-323976280777,false
308555687367,Entry Tickets - April/September,Entry Tickets - April/September,18374642398,2022-07-21,https://www.eventbrite.co.uk/e/entry-tickets-aprilseptember-tickets-308555687367,false
288785032807,Free dance class - Brazilian music - Party (Thursdays in Islington  N1),Bring some warm Brazilian vibes and smiles to your Thursday - try a Brazilian forró dance class for free and join the party afterwards!,35523645963,2022-07-21,https://www.eventbrite.co.uk/e/free-dance-class-brazilian-music-party-thursdays-in-islington-n1-tickets-288785032807,false
335203431487,Jungle Mania Summer BBQ - All Day All Night,The Summer BBQ returns to Oval Space in East London... kicking off at 4pm on the outside terrace & then moving inside til 5am!,29089606765,2022-08-20,https://www.eventbrite.co.uk/e/jungle-mania-summer-bbq-all-day-all-night-tickets-335203431487,false
269588726137,Queen's Platinum Jubilee Footprints Summer Family Office Conference,Our Queen's Platinum  Jubilee Footprints Family Office Summer Conference,9002664588,2022-07-21,https://www.eventbrite.co.uk/e/queens-platinum-jubilee-footprints-summer-family-office-conference-tickets-269588726137,false
345701150447,Bexleyheath Market,We are proud to announce a brand new Night Market in Bexleyheath!,47369852983,2022-07-29,https://www.eventbrite.co.uk/e/bexleyheath-market-tickets-345701150447,false
306489166347,Onsite (Hybrid) - London’s Villages: Greenwich,There is much more to this corner of South-East London than the Cutty Sark and the Royal Observatory.,3623855655,2022-08-01,https://www.eventbrite.co.uk/e/onsite-hybrid-londons-villages-greenwich-tickets-306489166347,false
322424328847,MAWNIN PREMIUM BREAKFAST PARTY,Breakfast is the most important time of the day to Fete.  Welcome to Mawnin Breakfast Party,33252222525,2022-08-21,https://www.eventbrite.co.uk/e/mawnin-premium-breakfast-party-tickets-322424328847,false
250140897157,Hip-Hop vs RnB Boat Party,After 4 sold out boat parties last year London’s hypest party is taking to The Thames for this very special night once again in 2022.,8300899379,2022-07-30,https://www.eventbrite.co.uk/e/hip-hop-vs-rnb-boat-party-tickets-250140897157,false
333523436577,Waves Boat Party - Carnival Cooldown,The Waves Team is back with a bang to give you that Post-Summer  boat party you didn't know you needed.,6880529907,2022-09-04,https://www.eventbrite.co.uk/e/waves-boat-party-carnival-cooldown-tickets-333523436577,false
382004765537,Ecstatic Dance - ✺ Sacred Sanctum Of Light ✺,A truly transcendent opportunity to serenade with all the colours of the rainbow ✨,36132266693,2022-07-23,https://www.eventbrite.co.uk/e/ecstatic-dance-sacred-sanctum-of-light-tickets-382004765537,false
303319856857,Comedy Cabin: RAW,Comedy's hippest hidden gem!,19955450131,2022-07-27,https://www.eventbrite.co.uk/e/comedy-cabin-raw-tickets-303319856857,false
271693110407,Ginger's Big Drag Bingo: Saturdays (Doors 6pm) Show 8-9.30pm,A hilarious bingo-meets-game show night with a twist on the classic numbers game.,29708198809,2022-07-30,https://www.eventbrite.co.uk/e/gingers-big-drag-bingo-saturdays-doors-6pm-show-8-930pm-tickets-271693110407,false
354659374737,Life Drawing for Beginners: Drop-in traditional figure & portrait course,A fun and fast paced Life-drawing course for beginners. Drop-in and start learning any week   all materials and equipment provided.,27970620309,2022-07-27,https://www.eventbrite.co.uk/e/life-drawing-for-beginners-drop-in-traditional-figure-portrait-course-tickets-354659374737,false
274458391437,JAZZMO’THOLOGY presents ‘SOULFUL Sunday Open Mic’ @ Prince of Peckham,null,26870996449,2022-08-14,https://www.eventbrite.co.uk/e/jazzmothology-presents-soulful-sunday-open-mic-prince-of-peckham-tickets-274458391437,false
312035776407,Sunday Touch Project cic. Come Celebrate Touch Project's 1st Birthday !,Touch Project CIC brings the world of conscious connection together to improve your wellbeing. Join us for touch  comfort & connection.,34003376049,2022-07-31,https://www.eventbrite.co.uk/e/sunday-touch-project-cic-come-celebrate-touch-projects-1st-birthday-tickets-312035776407,false
347976335587,Royal Gunpowder Mills - explore our explosive visitor attraction!,Discover our explosive history through science shows  tractor tours  narrow gauge railway  exhibitions  historic buildings and nature!,12296793198,2022-07-24,https://www.eventbrite.co.uk/e/royal-gunpowder-mills-explore-our-explosive-visitor-attraction-tickets-347976335587,false
