Event_Id,Event_Name,Event_Summary,Event_Organizer,start_date,url,is_online_event
290252020607,Outdoor Theatre: Awful Auntie presented by Heartbreak Productions,Join Heartbreak as they present Awful Auntie at Osterley.,19806788735,2022-08-19,https://www.eventbrite.co.uk/e/outdoor-theatre-awful-auntie-presented-by-heartbreak-productions-tickets-290252020607,false
322551087987,KAPA KRAV MAGA,KAPAP KRAV MAGA is a cutting edge self-defence/combat system based on ideas and techniques from many martial arts.,29245268825,2022-07-25,https://www.eventbrite.co.uk/e/kapa-krav-maga-tickets-322551087987,false
307032792347,Dom Stockbridge band,TAM regular Dom Stockbride's debut with his own band is not to be missed!,33409225909,2022-08-11,https://www.eventbrite.co.uk/e/dom-stockbridge-band-tickets-307032792347,false
354452435777,Love Parks Week (FREE Family Event),As  part of Love Parks Weeks (www.keepbritaintidy.org) TCV will be running FREE family events across the borough,33185313417,2022-08-02,https://www.eventbrite.co.uk/e/love-parks-week-free-family-event-tickets-354452435777,false
382163400017,Baby Bounce and Rhyme at Orpington Library,Baby Bounce and Rhyme Times are a fun half hour session of songs and rhymes suitable for babies and toddlers and their carers.,35204487383,2022-07-21,https://www.eventbrite.co.uk/e/baby-bounce-and-rhyme-at-orpington-library-tickets-382163400017,false
326042490867,Community Yoga at Pamban Chai & Coffee House,Hosting weekly community classes and providing mutual support for new yoga teachers. Every Friday 9am at Pamban Chai & Coffee House.,45847007163,2022-07-22,https://www.eventbrite.com/e/community-yoga-at-pamban-chai-coffee-house-tickets-326042490867,false
327232058897,BRING YOUR BABY PUB QUIZ @ The Great Southern  GIPSY HILL / CRYSTAL PALACE,From the creator of ‘Bring Your Baby Guided London Walks’  ‘Bring Your Baby Pub Quizzes’ are fun  brain-stimulating daytime parent socials.,33631952155,2022-07-26,https://www.eventbrite.co.uk/e/bring-your-baby-pub-quiz-the-great-southern-gipsy-hill-crystal-palace-tickets-327232058897,false
250234156097,Story 'n' Rhymes at Walthamstow Library,Rhyme Time,11667141273,2022-07-21,https://www.eventbrite.co.uk/e/story-n-rhymes-at-walthamstow-library-tickets-250234156097,false
167991728783,Outdoor adventure game in London - The Case of Colombia's Finest,A scavenger hunt with an emphasis on captivating locations and an engaging overall mystery to solve. Fully flexible tickets - start anytime.,34201102513,2022-07-21,https://www.eventbrite.co.uk/e/outdoor-adventure-game-in-london-the-case-of-colombias-finest-tickets-167991728783,false
242926528787,Grow Your Business Show 2022 - Surrey Business Expo,Surrey's fastest growing business exhibition is back for 2022 taking place at Epsom Downs Racecourse on 22nd Sept 8AM-4PM,18013648003,2022-09-22,https://www.eventbrite.co.uk/e/grow-your-business-show-2022-surrey-business-expo-tickets-242926528787,false
349795827737,** Tower and Return ( Kayaking from Greenwich to Tower Bridge and Back).,Kayak from Greenwich to the Tower and Return. A trip with the tide both ways pushing you along. Great views of the fabulous Tidal Thames.,8551940451,2022-07-24,https://www.eventbrite.co.uk/e/tower-and-return-kayaking-from-greenwich-to-tower-bridge-and-back-tickets-349795827737,false
324180200707,Holiday workshops: How big is the universe? (ages 13–15),In this workshop for 13–15 year-olds  students will use mathematics to try to understand how the universe works.,4269650797,2022-08-12,https://www.eventbrite.co.uk/e/holiday-workshops-how-big-is-the-universe-ages-1315-tickets-324180200707,false
220537091377,Giselle Adult Repertoire Workshop (London 2022),Discover choreography from Giselle.,8648616479,2022-07-23,https://www.eventbrite.co.uk/e/giselle-adult-repertoire-workshop-london-2022-registration-220537091377,false
247168486597,Comedy at the Flo,Join us at the Florence in Herne Hill for a night of comedy hosted by Alfie Packham and Adam Flood.,40042397343,2022-07-27,https://www.eventbrite.co.uk/e/comedy-at-the-flo-tickets-247168486597,false
336313010267,Morden Library Rhymetime (Ages 2-5),Come to Morden Library for a sing-along!,26471263771,2022-07-27,https://www.eventbrite.co.uk/e/morden-library-rhymetime-ages-2-5-tickets-336313010267,false
217410910887,Whitechapel Women: Beyond the Jack the Ripper Tour,Join us to hear the untold story of Jack the Ripper’s victims and see this overlooked history.,11838042264,2022-07-28,https://www.eventbrite.co.uk/e/whitechapel-women-beyond-the-jack-the-ripper-tour-tickets-217410910887,false
350612991897,Bashment X Afrobeats - Shoreditch Jamaican Independence Party,Bashment X Afrobeats Is Finally Back!,33348527977,2022-08-05,https://www.eventbrite.co.uk/e/bashment-x-afrobeats-shoreditch-jamaican-independence-party-tickets-350612991897,false
324152939167,Holiday workshops: Codes and ciphers (ages 10–12),In this workshop for 10–12 year-olds  students will explore codes and ciphers from the last 2000 years.,4269650797,2022-08-02,https://www.eventbrite.co.uk/e/holiday-workshops-codes-and-ciphers-ages-1012-tickets-324152939167,false
324059981127,Holiday workshops: Building with STIXX (ages 10–12),In this workshop for 10–12 year olds  students will build giant 3D structures using geometric shapes.,4269650797,2022-08-02,https://www.eventbrite.co.uk/e/holiday-workshops-building-with-stixx-ages-1012-tickets-324059981127,false
351115414657,TOUR St John Ambulance: A Victorian Masterpiece,Visit the spectacular Victorian interiors of St John’s Gate to discover the personal stories of St John Ambulance’s dedicated women and men.,17360397033,2022-07-23,https://www.eventbrite.co.uk/e/tour-st-john-ambulance-a-victorian-masterpiece-tickets-351115414657,false
248586066617,WEDNESDAY- LIVE MUSIC  NIGHTS WITH  | 2 FREE COCKTAILS PER TICKET,Use your tickets to get  2 free drinks from our Live Music Special Menu  don’t forget to book your table.,35562375183,2022-07-27,https://www.eventbrite.co.uk/e/wednesday-live-music-nights-with-2-free-cocktails-per-ticket-tickets-248586066617,false
351989017627,Web3 Gen career series : Web3 Marketing,W3G has 3 career series lined up to help early professionals and students learn more about careers available in web3,46423212563,2022-07-21,https://www.eventbrite.co.uk/e/web3-gen-career-series-web3-marketing-tickets-351989017627,false
334584299647,Morden Library Lego & Puzzle Club Tuesday  (4-11years),Morden Library-Lego & Puzzle Club  (4-11 years),26471263771,2022-07-26,https://www.eventbrite.co.uk/e/morden-library-lego-puzzle-club-tuesday-4-11years-tickets-334584299647,false
367493792827,Aga Khan Centre Weekly Tours,Designed by Japanese Pritzker Prize-winning architect  Fumihiko Maki  the Aga Khan Centre is designed to represent the values of openness.,17826513165,2022-07-21,https://www.eventbrite.com/e/aga-khan-centre-weekly-tours-registration-367493792827,false
368223595687,Sparkles Babies,A group for new parents/carers with their babies.,18688239317,2022-07-27,https://www.eventbrite.co.uk/e/sparkles-babies-tickets-368223595687,false
317553680607,CoderDojo @ Sutton Life Centre,CoderDojo is a free and open coding club for young people aged 7 to 17. Come - with a laptop - on the last Friday of the month to pick up ne,17503239983,2022-07-29,https://www.eventbrite.co.uk/e/coderdojo-sutton-life-centre-tickets-317553680607,false
331250137077,Interesting 2022,The usual nonsense.,1251836945,2022-09-03,https://www.eventbrite.com/e/interesting-2022-tickets-331250137077,false
224784425267,LONDON FASHION GALA S/S 23 -  September 16th 2022,LONDON FASHION GALA (S/S 23) – Friday September 16th  2022  Presented by SMGlobal Catwalk  During The Official LFW Calendar,8927844488,2022-09-16,https://www.eventbrite.com/e/london-fashion-gala-ss-23-september-16th-2022-tickets-224784425267,false
315260070357,FREE TOUR- Fire  Pestilence and Plague,FREE TOUR- Fire  Pestilence and Plague,8146416516,2022-07-24,https://www.eventbrite.co.uk/e/free-tour-fire-pestilence-and-plague-tickets-315260070357,false
308913447437,African Drumming Wellbeing Session,African Drumming Wellness and Wellbeing Workshop (18yrs+),33641057449,2022-07-25,https://www.eventbrite.co.uk/e/african-drumming-wellbeing-session-tickets-308913447437,false
370015415067,Children's Workshop: Messy Makers (Victoria Park),A  child-led arts class providing your child with the freedom to explore and create.,40384696783,2022-07-24,https://www.eventbrite.co.uk/e/childrens-workshop-messy-makers-victoria-park-tickets-370015415067,false
373531692347,Women's Weekly Meditation Group,A friendly meditation group for women,7930003153,2022-08-19,https://www.eventbrite.co.uk/e/womens-weekly-meditation-group-tickets-373531692347,false
324123180157,Holiday workshops: Magic squares (ages 10–12),Explore the properties of magic squares  using number sense  creativity and reasoning.,4269650797,2022-07-25,https://www.eventbrite.co.uk/e/holiday-workshops-magic-squares-ages-1012-tickets-324123180157,false
317971119177,Westminster Abbey Summer Organ Festival: Thomas Trotter,Discover the Abbey’s awe-inspiring grand organ as Thomas Trotter pays tribute to Her Majesty The Queen in her Platinum Jubilee year,4655392217,2022-08-09,https://www.eventbrite.co.uk/e/westminster-abbey-summer-organ-festival-thomas-trotter-tickets-317971119177,false
311419723777,DESIGN THINKING & INNOVATION WEEK 2022,This programme is designed to give you inspiration and tools for your work,6623718725,2022-08-09,https://www.eventbrite.co.uk/e/design-thinking-innovation-week-2022-tickets-311419723777,false
267808611767,Arise - Praise & Prayer Evening,St Luke's & Zion City are excited to be hosting praise & prayer nights on the last or 4th Sunday of the month for E14 to gather to seek God,41448139133,2022-07-24,https://www.eventbrite.co.uk/e/arise-praise-prayer-evening-tickets-267808611767,false
337447734257,Fintech for Skiggle,Skiggle is an unique charity supporting disabled children and their families. Please join us for this drinks event to raise money,46813737233,2022-07-28,https://www.eventbrite.co.uk/e/fintech-for-skiggle-tickets-337447734257,false
342627426857,THE TUMULTUOUS CITY - The Architecture of Covent Garden & St Giles,A walk recalling urban clamour and architectural change through the buildings and eclectic streetscapes of Covent Garden & St Giles,10770567886,2022-08-06,https://www.eventbrite.co.uk/e/the-tumultuous-city-the-architecture-of-covent-garden-st-giles-tickets-342627426857,false
332950964297,Aerial Hoop Workshops,Aerial Hoop Workshop,46425639433,2022-08-08,https://www.eventbrite.co.uk/e/aerial-hoop-workshops-tickets-332950964297,false
342424168907,TeeKeh Sax Live In Concert,Exciting Evening of Worship and Praise,47130358173,2022-07-30,https://www.eventbrite.co.uk/e/teekeh-sax-live-in-concert-tickets-342424168907,false
243526904527,BNI Spitfires Networking Breakfast,Join us for a great breakfast  and an energising networking meeting with 50+ local business owners.,14849517051,2022-07-22,https://www.eventbrite.co.uk/e/bni-spitfires-networking-breakfast-tickets-243526904527,false
324710045487,Holiday workshops: Spectacular colour chemistry (ages 13–15),Discover what a colour actually is  understand how objects become coloured  and how Chemists can manipulate these aspects to produce dyes.,4269650797,2022-08-05,https://www.eventbrite.co.uk/e/holiday-workshops-spectacular-colour-chemistry-ages-1315-tickets-324710045487,false
334474310667,London Tennis Meetup ( Social & Weekend Tournaments ),Tennis and Socialization @London Bridge. Weekly Tournaments &Prize. Visit us  Facebook: LondonTennisMeetup /  Instagram: LondonTennisLeague,30787091560,2022-07-24,https://www.eventbrite.co.uk/e/london-tennis-meetup-social-weekend-tournaments-tickets-334474310667,false
348606801327,Panel Discussion: Antisemitism Today,Part of the Library’s Fighting Antisemitism from Dreyfus to Today exhibition events series,5900606123,2022-07-26,https://www.eventbrite.co.uk/e/panel-discussion-antisemitism-today-tickets-348606801327,false
329508196887,The Wind in the Willows - Open Air Theatre,Join us for an outdoor performance of the family classic Wind in the Willows by award-winning theatre company Calf 2 Cow,35795829,2022-08-24,https://www.eventbrite.co.uk/e/the-wind-in-the-willows-open-air-theatre-tickets-329508196887,false
334393157937,TANGO CLASSES • Beginner levels,TANGO CLASSES  •  Beginner levels,34214630551,2022-07-25,https://www.eventbrite.co.uk/e/tango-classes-beginner-levels-tickets-334393157937,false
338906918717,CLSG year 7 (11+) open events for 2023 entry,DISCOVER WHAT LIFE AT CITY IS LIKE,18289737193,2022-09-27,https://www.eventbrite.co.uk/e/clsg-year-7-11-open-events-for-2023-entry-tickets-338906918717,false
362610135677,Adult's Workshop: Sip and Paint,Sip and paint - guided by artist,40384696783,2022-07-22,https://www.eventbrite.co.uk/e/adults-workshop-sip-and-paint-tickets-362610135677,false
323482092647,Your Communication Skills Are Key To Your Success - Taster sessions,“To succeed in business  you need to be good with people”. Lunch and Learn sessions that will profoundly impact the way you do business.,45653955193,2022-07-28,https://www.eventbrite.co.uk/e/your-communication-skills-are-key-to-your-success-taster-sessions-tickets-323482092647,false
323256096687,Capital Summer School,A week long Summer School for Year 5 & 6 students,37888424343,2022-07-25,https://www.eventbrite.co.uk/e/capital-summer-school-tickets-323256096687,false
324719945097,Holiday workshops: Forensics (ages 16–18),Experience what it would be like to work in a forensics lab by investigating a fictional crime scene,4269650797,2022-08-10,https://www.eventbrite.co.uk/e/holiday-workshops-forensics-ages-1618-tickets-324719945097,false
325180743357,Pizza & Prospects,Whether you know your end goal  or are unsure of your next steps  come and chat with our team about your options  and enjoy some great food!,9224581206,2022-08-04,https://www.eventbrite.co.uk/e/pizza-prospects-registration-325180743357,false
341791647017,SENSORY SOUND & GONG BATH AT THE MANDRAKE,Tantalise the senses as you are immersed in a textured soundscape designed to inspire deep healing and restoration.,17825575648,2022-07-28,https://www.eventbrite.co.uk/e/sensory-sound-gong-bath-at-the-mandrake-tickets-341791647017,false
170284340045,Summertime Live Windsor 2022,Summertime Live returns to Windsor Racecourse for another huge festival experience and Berkshire’s biggest party of the summer!,19928264152,2022-08-13,https://www.eventbrite.co.uk/e/summertime-live-windsor-2022-tickets-170284340045,false
308969184147,KupoCon: FINAL FANTASY XV – Anniversary Tour [London],To celebrate the passing of the five-year anniversary  KupoCon will host multiple celebrations for FINAL FANTASY XV.,10857556574,2022-08-27,https://www.eventbrite.ca/e/kupocon-final-fantasy-xv-anniversary-tour-london-tickets-308969184147,false
334870936987,DANCEHALL OVERLOAD,LADIES SPECIAL,35546514933,2022-07-29,https://www.eventbrite.co.uk/e/dancehall-overload-tickets-334870936987,false
272374729147,MumSing Disney Singalong 2022,We're back! With new songs! We can't have a Disney Singalong without "We don't Talk About Bruno"!,19859768012,2022-07-25,https://www.eventbrite.co.uk/e/mumsing-disney-singalong-2022-tickets-272374729147,false
272699811477,MADE IN GHANA-UK FESTIVAL LONDON 2022,MADE IN GHANA-UK FESTIVAL 2022 is scheduled for Saturday and Sunday OCTOBER 29-30 2022.,18466612715,2022-10-29,https://www.eventbrite.co.uk/e/made-in-ghana-uk-festival-london-2022-tickets-272699811477,false
170399577724,The 9th European Conference on Media  Communication & Film (EuroMedia2022),Organised by the International Academic Forum (IAFOR) and held in partnership with Birkbeck  University of London,26736900301,2022-07-21,https://www.eventbrite.com/e/the-9th-european-conference-on-media-communication-film-euromedia2022-tickets-170399577724,false
316662254327,SOPHIE: The Play,Join us for a performance of the play SOPHIE  by Emily Curtis and Sophie Potter  exploring family life  stigma and Down syndrome.,7823973102,2022-08-04,https://www.eventbrite.co.uk/e/sophie-the-play-tickets-316662254327,false
98981425107,Belinda Carlisle's Birthday Party at  The Royal Vauxhall Tavern,Would you like to come to Belinda Carlisle's Birthday Party in London ?,15938808084,2022-08-19,https://www.eventbrite.co.uk/e/belinda-carlisles-birthday-party-at-the-royal-vauxhall-tavern-tickets-98981425107,false
335446568717,Late night boozy pottery painting- Thursday,Overview  At Social Pottery all our sessions are designed to be fun  chilled and creative! We believe in the power of art and its ability,44720808573,2022-07-28,https://www.eventbrite.co.uk/e/late-night-boozy-pottery-painting-thursday-tickets-335446568717,false
319703350327,Delicious History Tour,Delicious History Tour,11264447008,2022-07-28,https://www.eventbrite.co.uk/e/delicious-history-tour-tickets-319703350327,false
314570537947,Alex vs Men  -  £5 Comedy + Free Drink,Alex vs Men is a comedy battle brought to you by comedian Alexandra Haddow & a Random Man,43462692983,2022-07-25,https://www.eventbrite.co.uk/e/alex-vs-men-5-comedy-free-drink-tickets-314570537947,false
350521237457,Pottery Making Taster  Class!!!,Try your hand at hand-building and throwing your own ceramics in this beginners clay pottery class!,27429277249,2022-07-25,https://www.eventbrite.co.uk/e/pottery-making-taster-class-tickets-350521237457,false
213483915137,Hustle Awards 2022,Here to celebrate all the founders  co-founders and team members that have disrupted  impacted and taken a leap of faith with their business,16989113112,2022-07-21,https://www.eventbrite.com/e/hustle-awards-2022-tickets-213483915137,false
308579458467,Brown Girls' Book Club 2022,SASS presents... the Brown Girls' Book Club! We pick a book by a South Asian female author  and get together to discuss themes & connect,31282717827,2022-08-25,https://www.eventbrite.co.uk/e/brown-girls-book-club-2022-tickets-308579458467,false
268766105657,UK Open Mic @ Two Bridges / LONDON BRIDGE / SOUTHWARK / BERMONDSEY,Warm  welcoming and free open mic  every Monday at the Two Bridges,19808007205,2022-07-25,https://www.eventbrite.co.uk/e/uk-open-mic-two-bridges-london-bridge-southwark-bermondsey-tickets-268766105657,false
296172047567,Circling & Authentic Relating,Explore cutting edge connection practices and experience liberation.,8057382611,2022-08-03,https://www.eventbrite.co.uk/e/circling-authentic-relating-registration-296172047567,false
152733424785,Shoreditch Pub Crawl ending at EGG // Free Shots // Drinks Deals AND MORE!,Welcome to the London Pub Crawl  the best way to explore the nightlife festivities of the capital!  5 Venues  Free Shots  Discounted Drinks!,32620827483,2022-07-22,https://www.eventbrite.co.uk/e/shoreditch-pub-crawl-ending-at-egg-free-shots-drinks-deals-and-more-tickets-152733424785,false
338956687577,ComedyMania: LAUGH IN THE BOX!,It's the one you've all been waiting for...LAUGH IN THE BOX is back at BOXPARK Croydon for their takeover of our BEATBOX space.,29510359561,2022-08-10,https://www.eventbrite.co.uk/e/comedymania-laugh-in-the-box-tickets-338956687577,false
176280970127,Tour of the UK Supreme Court,A tour around the highest court in the land   housed in a beautiful Grade II Listed building.,6173178869,2022-09-09,https://www.eventbrite.co.uk/e/tour-of-the-uk-supreme-court-tickets-176280970127,false
335795672897,Sip And Celebrate Pop Up Event,Sip And Celebrate With Our Amazing Businesses ♡,34938387633,2022-08-20,https://www.eventbrite.co.uk/e/sip-and-celebrate-pop-up-event-tickets-335795672897,false
250195520537,HIP-HOP VS DANCEHALL - CARNIVAL SPECIAL BOAT PARTY,After last year’s sold out party London’s best Hip-Hop and Dancehall party sets sail again!,8300899379,2022-08-27,https://www.eventbrite.co.uk/e/hip-hop-vs-dancehall-carnival-special-boat-party-tickets-250195520537,false
289866186567,London Bar Crawl (Camden),Pub Crawl  Free Shots  Free Entry to all venues  Free access to the photos. Experience Camden Like you Never Have Before- On the Rocks!,33989964823,2022-07-22,https://www.eventbrite.co.uk/e/london-bar-crawl-camden-tickets-289866186567,false
295379366637,Free Forex and Crypto  Introduction workshop in London,Wealth Creation in Digital Age,15734973158,2022-07-23,https://www.eventbrite.com/e/free-forex-and-crypto-introduction-workshop-in-london-tickets-295379366637,false
290351076887,Overjam Festival Launch Party w/ Channel One Sound System,Overjam Festival Launch Party w/ Channel One Sound System,20229719672,2022-07-24,https://www.eventbrite.co.uk/e/overjam-festival-launch-party-w-channel-one-sound-system-tickets-290351076887,false
227141635747,2022 - Close Protection and Security Conference,The 2022 Close Protection World conference.,16982988538,2022-11-12,https://www.eventbrite.co.uk/e/2022-close-protection-and-security-conference-tickets-227141635747,false
350380486467,Denmark Hill Campus Tours | Mar - Aug 2022,Experience King's College London's Denmark Hill Campus on a guided tour with a current student.,8647847131,2022-07-27,https://www.eventbrite.co.uk/e/denmark-hill-campus-tours-mar-aug-2022-tickets-350380486467,false
334881558757,Jazz at St John's Churchyard,An afternoon of jazz  blues and grooves presented by the Unity Music Arts Team  featuring some of London's finest up-and-coming musicians.,31186885665,2022-08-21,https://www.eventbrite.co.uk/e/jazz-at-st-johns-churchyard-tickets-334881558757,false
239937097317,Live Jazz Jam w/ Stratos led by Rio Kai (SEED Ensemble & Nerija),Led by the Mercury Prize nominated Rio Kai  Stratos take us on a voyage through classic & modern Jazz every Thursday at Grow!,16862798053,2022-07-21,https://www.eventbrite.co.uk/e/live-jazz-jam-w-stratos-led-by-rio-kai-seed-ensemble-nerija-tickets-239937097317,false
119995241999,SUNDAY JAM  2022,VINCY ALLIANCE MAS NOTTING HILL  T-SHIRT BAND,15447283328,2022-08-28,https://www.eventbrite.co.uk/e/sunday-jam-2022-tickets-119995241999,false
347410272477,People  Planet  Pint: Sustainability Professionals Meetup - London,Come and meet other business owners and professionals working in the Net Zero  BCorp and Environmental space!,32771843245,2022-08-04,https://www.eventbrite.co.uk/e/people-planet-pint-sustainability-professionals-meetup-london-tickets-347410272477,false
345754309447,UCOJ : HIT THE DECK PT2 - SUMMER BOAT PARTY,We are back for our sellout boat party  for anyone that’s ever been before you know this needs no introduction… Let’s sail all JUNGLIST,29211588703,2022-08-12,https://www.eventbrite.co.uk/e/ucoj-hit-the-deck-pt2-summer-boat-party-tickets-345754309447,false
168955166451,Flamenco  Sevillanas and Spanish Dance Classes,Flamenco  Sevillanas and Spanish Dance Classes in Camden every Saturday!,34348758923,2022-07-23,https://www.eventbrite.co.uk/e/flamenco-sevillanas-and-spanish-dance-classes-tickets-168955166451,false
339079565107,World Class Studios Roadshow - London,World Class Studios Sign Up,46871025463,2022-08-22,https://www.eventbrite.co.uk/e/world-class-studios-roadshow-london-tickets-339079565107,false
301561698157,Saturday Stand Up Comedy Club  Covent Garden,Hard-hitting stand up comedy  featuring award-winning  international comedians.,1010795383,2022-07-23,https://www.eventbrite.co.uk/e/saturday-stand-up-comedy-club-covent-garden-tickets-301561698157,false
184777523547,Sensory Rhyme Time @ Lea Bridge Library,Sensory Rhyme Time @ Lea Bridge Library,11667141273,2022-07-22,https://www.eventbrite.co.uk/e/sensory-rhyme-time-lea-bridge-library-tickets-184777523547,false
338173093827,ARTHUB STUDIOS DEPTFORD - Hybrid Session (PICASSO THEMED),Come and enjoy an untutored relaxed class at Art Hub Studios Deptford with 2B Or Not 2B Collective - Picasso themed!,32803855775,2022-08-02,https://www.eventbrite.co.uk/e/arthub-studios-deptford-hybrid-session-picasso-themed-tickets-338173093827,false
328103344937,Cattle Walks - Chingford,Join us for a walk in Epping Forest  meet the Cattle that live here and find out the important role they play in looking after the Forest. .,9768889881,2022-07-31,https://www.eventbrite.co.uk/e/cattle-walks-chingford-tickets-328103344937,false
313205866177,Hidden Spaces tours at St Alfege Church,Join us for a tour of the hidden spaces at St Alfege Church in Greenwich,12802228652,2022-07-23,https://www.eventbrite.co.uk/e/hidden-spaces-tours-at-st-alfege-church-tickets-313205866177,false
338231909747,Saturday Bottomless Brunch Comedy,Open bar runs -14:30-16:00 / Comedy show runs - 16:00-17:45,43462692983,2022-07-30,https://www.eventbrite.co.uk/e/saturday-bottomless-brunch-comedy-tickets-338231909747,false
169471053483,Kings Cross Film Awards,Kings Cross FIlm Awards is a free  three day international film festival in central London. Showcasing the best new features and short films,34381971797,2022-08-23,https://www.eventbrite.co.uk/e/kings-cross-film-awards-tickets-169471053483,false
269053043897,London’s Jewish East End:  A Live Walk through Its Heart & Soul,For over a century   East London was the epicenter of Jewish life and culture  and vestiges of its heart and soul lurk around every corner.,32528350645,2022-08-07,https://www.eventbrite.co.uk/e/londons-jewish-east-end-a-live-walk-through-its-heart-soul-tickets-269053043897,false
226036028847,WE LIKE TO FUNK  LIKE TO FUNK YEAH,Funk & Soul at  Kiss The Sky are like n other. Live Djs play Funk  Soul  70s and 80s music to a sing a long crowd and brilliant atmosphere.,33274489309,2022-07-21,https://www.eventbrite.co.uk/e/we-like-to-funk-like-to-funk-yeah-tickets-226036028847,false
